{
  "schema_version": "1",
  "task_id": "issue-231-claude-runtime-capability-negotiation",
  "generated_by": "ChatGPT/Codex",
  "execution_contract_path": ".specbridge/contracts/issue-231-claude-runtime-capability-negotiation.execution.md",
  "changed_files": [
    ".specbridge/artifact-inventory/current.inventory.json",
    ".specbridge/audit-packets/issue-231-claude-runtime-capability-negotiation.audit-packet.json",
    ".specbridge/audits/issue-231-claude-runtime-capability-negotiation.chatgpt-audit.json",
    ".specbridge/context/CURRENT_GOAL.md",
    ".specbridge/contracts/issue-231-claude-runtime-capability-negotiation.execution.md",
    ".specbridge/github-evidence/issue-231-claude-runtime-capability-negotiation.closure.json",
    ".specbridge/ledger/operations.ndjson",
    ".specbridge/mcp-resources/operator-state.catalog.json",
    ".specbridge/reports/issue-231-claude-runtime-capability-negotiation.final-report.json",
    ".specbridge/scopes/issue-231-claude-runtime-capability-negotiation.scope.json",
    ".specbridge/schemas/runtime-execution.schema.json",
    ".specbridge/schemas/runtime-launch.schema.json",
    ".specbridge/standard-readiness/current.status.json",
    ".specbridge/state/current-goal.json",
    "README.md",
    "docs/specbridge-claude-runtime-capability-negotiation.md",
    "docs/specbridge-runtime-runner.md",
    "docs/specbridge-studio.html",
    "docs/status-dashboard.html",
    "scripts/lib/dashboards.ps1",
    "scripts/lib/runtime.ps1",
    "scripts/lib/status.ps1",
    "scripts/specbridge.ps1",
    "scripts/test-specbridge-cli.ps1",
    "scripts/validate-runtime-executions.ps1",
    "scripts/validate-runtime-launches.ps1"
  ],
  "diff_summary": [
    { "file": "scripts/specbridge.ps1", "added_lines": null, "deleted_lines": null },
    { "file": "scripts/lib/status.ps1", "added_lines": null, "deleted_lines": null },
    { "file": "scripts/lib/runtime.ps1", "added_lines": null, "deleted_lines": null },
    { "file": "scripts/test-specbridge-cli.ps1", "added_lines": null, "deleted_lines": null },
    { "file": "scripts/validate-runtime-launches.ps1", "added_lines": null, "deleted_lines": null },
    { "file": "scripts/validate-runtime-executions.ps1", "added_lines": null, "deleted_lines": null },
    { "file": ".specbridge/schemas/runtime-launch.schema.json", "added_lines": null, "deleted_lines": null },
    { "file": ".specbridge/schemas/runtime-execution.schema.json", "added_lines": null, "deleted_lines": null },
    { "file": "docs/specbridge-runtime-runner.md", "added_lines": null, "deleted_lines": null },
    { "file": "docs/specbridge-claude-runtime-capability-negotiation.md", "added_lines": null, "deleted_lines": 0 },
    { "file": "docs/status-dashboard.html", "added_lines": null, "deleted_lines": null },
    { "file": "docs/specbridge-studio.html", "added_lines": null, "deleted_lines": null },
    { "file": "scripts/lib/dashboards.ps1", "added_lines": null, "deleted_lines": null },
    { "file": "README.md", "added_lines": null, "deleted_lines": null },
    { "file": ".specbridge/artifact-inventory/current.inventory.json", "added_lines": null, "deleted_lines": null },
    { "file": ".specbridge/mcp-resources/operator-state.catalog.json", "added_lines": null, "deleted_lines": null },
    { "file": ".specbridge/standard-readiness/current.status.json", "added_lines": null, "deleted_lines": null },
    { "file": ".specbridge/contracts/issue-231-claude-runtime-capability-negotiation.execution.md", "added_lines": null, "deleted_lines": 0 },
    { "file": ".specbridge/github-evidence/issue-231-claude-runtime-capability-negotiation.closure.json", "added_lines": null, "deleted_lines": 0 },
    { "file": ".specbridge/scopes/issue-231-claude-runtime-capability-negotiation.scope.json", "added_lines": null, "deleted_lines": 0 },
    { "file": ".specbridge/context/CURRENT_GOAL.md", "added_lines": null, "deleted_lines": null },
    { "file": ".specbridge/state/current-goal.json", "added_lines": null, "deleted_lines": null },
    { "file": ".specbridge/ledger/operations.ndjson", "added_lines": null, "deleted_lines": null },
    { "file": ".specbridge/reports/issue-231-claude-runtime-capability-negotiation.final-report.json", "added_lines": null, "deleted_lines": 0 },
    { "file": ".specbridge/audit-packets/issue-231-claude-runtime-capability-negotiation.audit-packet.json", "added_lines": null, "deleted_lines": 0 },
    { "file": ".specbridge/audits/issue-231-claude-runtime-capability-negotiation.chatgpt-audit.json", "added_lines": null, "deleted_lines": 0 }
  ],
  "validation_commands": [
    "powershell -NoProfile -ExecutionPolicy Bypass -File ./scripts/validate-contracts.ps1",
    "powershell -NoProfile -ExecutionPolicy Bypass -File ./scripts/validate-contract-scopes.ps1",
    "powershell -NoProfile -ExecutionPolicy Bypass -File ./scripts/test-specbridge-cli.ps1",
    "powershell -NoProfile -ExecutionPolicy Bypass -File ./scripts/validate-runtime-launches.ps1",
    "powershell -NoProfile -ExecutionPolicy Bypass -File ./scripts/validate-runtime-executions.ps1",
    "powershell -NoProfile -ExecutionPolicy Bypass -File ./scripts/validate-final-reports.ps1",
    "powershell -NoProfile -ExecutionPolicy Bypass -File ./scripts/validate-audit-packets.ps1",
    "powershell -NoProfile -ExecutionPolicy Bypass -File ./scripts/validate-chatgpt-audits.ps1",
    "powershell -NoProfile -ExecutionPolicy Bypass -File ./scripts/specbridge-smoke.ps1",
    "git diff --check"
  ],
  "validation_results": [
    { "command": "powershell -NoProfile -ExecutionPolicy Bypass -File ./scripts/validate-contracts.ps1", "result": "passed" },
    { "command": "powershell -NoProfile -ExecutionPolicy Bypass -File ./scripts/validate-contract-scopes.ps1", "result": "passed" },
    { "command": "powershell -NoProfile -ExecutionPolicy Bypass -File ./scripts/test-specbridge-cli.ps1", "result": "passed" },
    { "command": "powershell -NoProfile -ExecutionPolicy Bypass -File ./scripts/validate-runtime-launches.ps1", "result": "passed" },
    { "command": "powershell -NoProfile -ExecutionPolicy Bypass -File ./scripts/validate-runtime-executions.ps1", "result": "passed" },
    { "command": "powershell -NoProfile -ExecutionPolicy Bypass -File ./scripts/validate-final-reports.ps1", "result": "passed" },
    { "command": "powershell -NoProfile -ExecutionPolicy Bypass -File ./scripts/validate-audit-packets.ps1", "result": "passed" },
    { "command": "powershell -NoProfile -ExecutionPolicy Bypass -File ./scripts/validate-chatgpt-audits.ps1", "result": "passed" },
    { "command": "powershell -NoProfile -ExecutionPolicy Bypass -File ./scripts/specbridge-smoke.ps1", "result": "passed" },
    { "command": "git diff --check", "result": "passed" },
    { "command": "GitHub Actions Foundation Validation", "result": "passed" },
    { "command": "GitHub Actions SpecBridge Review Gate", "result": "passed" },
    { "command": "GitHub Actions SpecBridge PR Review Report", "result": "passed" },
    { "command": "GitHub Actions Claude Review Non Blocking", "result": "passed" }
  ],
  "final_report_path": ".specbridge/reports/issue-231-claude-runtime-capability-negotiation.final-report.json",
  "ci_status": "passed",
  "pr_review_report_path": null,
  "policy_result": "Within policy. The change keeps live Claude Code execution behind bounded execute-runtime-launch gates, records dry-run no-launch behavior, omits raw provider output from capability status, does not access secrets, and does not alter billing, production, authentication, authorization, dependency, deployment, or CI/CD security configuration.",
  "unresolved_risks": [
    "The installed local Claude CLI currently reports no --max-turns support, so live launches rely on max_budget_usd and TimeoutSeconds until a supporting CLI version is installed."
  ],
  "completion_status": "complete",
  "source_files": [
    ".specbridge/contracts/issue-231-claude-runtime-capability-negotiation.execution.md",
    ".specbridge/github-evidence/issue-231-claude-runtime-capability-negotiation.closure.json",
    ".specbridge/scopes/issue-231-claude-runtime-capability-negotiation.scope.json",
    ".specbridge/reports/issue-231-claude-runtime-capability-negotiation.final-report.json",
    ".specbridge/audits/issue-231-claude-runtime-capability-negotiation.chatgpt-audit.json",
    "docs/specbridge-claude-runtime-capability-negotiation.md",
    "docs/specbridge-runtime-runner.md",
    "scripts/lib/dashboards.ps1",
    "scripts/lib/runtime.ps1",
    "scripts/lib/status.ps1",
    "scripts/test-specbridge-cli.ps1",
    "scripts/validate-runtime-executions.ps1",
    "scripts/validate-runtime-launches.ps1"
  ],
  "secret_omission": "This packet contains repository-relative paths, summaries, validation results, policy result, risks, and status only. It does not embed raw diffs, secrets, tokens, private keys, credentials, raw provider output, raw help output, or private prompt content."
}
