{
  "schema_version": "1",
  "task_id": "issue-078-v5-live-status-diagnostics",
  "generated_by": "specbridge-audit-packet-generator",
  "execution_contract_path": ".specbridge/contracts/issue-078-v5-live-status-diagnostics.execution.md",
  "changed_files": [
    ".specbridge/audit-packets/issue-078-v5-live-status-diagnostics.audit-packet.json",
    ".specbridge/audits/issue-078-v5-live-status-diagnostics.chatgpt-audit.json",
    ".specbridge/context/CURRENT_GOAL.md",
    ".specbridge/contracts/issue-078-v5-live-status-diagnostics.execution.md",
    ".specbridge/reports/issue-078-v5-live-status-diagnostics.final-report.json",
    ".specbridge/scopes/issue-076-v5-live-parallel-pilot.scope.json",
    ".specbridge/scopes/issue-078-v5-live-status-diagnostics.scope.json",
    ".specbridge/schemas/runtime-execution.schema.json",
    "README.md",
    "docs/specbridge-runtime-runner.md",
    "docs/specbridge-test-results.md",
    "docs/specbridge-v5-live-status.md",
    "scripts/specbridge.ps1",
    "scripts/test-specbridge-cli.ps1",
    "scripts/validate-runtime-executions.ps1"
  ],
  "diff_summary": [
    { "file": ".specbridge/audit-packets/issue-078-v5-live-status-diagnostics.audit-packet.json", "added_lines": null, "deleted_lines": null },
    { "file": ".specbridge/audits/issue-078-v5-live-status-diagnostics.chatgpt-audit.json", "added_lines": null, "deleted_lines": null },
    { "file": ".specbridge/context/CURRENT_GOAL.md", "added_lines": 19, "deleted_lines": 7 },
    { "file": ".specbridge/contracts/issue-078-v5-live-status-diagnostics.execution.md", "added_lines": null, "deleted_lines": null },
    { "file": ".specbridge/reports/issue-078-v5-live-status-diagnostics.final-report.json", "added_lines": null, "deleted_lines": null },
    { "file": ".specbridge/scopes/issue-076-v5-live-parallel-pilot.scope.json", "added_lines": 1, "deleted_lines": 1 },
    { "file": ".specbridge/scopes/issue-078-v5-live-status-diagnostics.scope.json", "added_lines": null, "deleted_lines": null },
    { "file": ".specbridge/schemas/runtime-execution.schema.json", "added_lines": 51, "deleted_lines": 0 },
    { "file": "README.md", "added_lines": 2, "deleted_lines": 0 },
    { "file": "docs/specbridge-runtime-runner.md", "added_lines": 47, "deleted_lines": 0 },
    { "file": "docs/specbridge-test-results.md", "added_lines": 8, "deleted_lines": 5 },
    { "file": "docs/specbridge-v5-live-status.md", "added_lines": null, "deleted_lines": null },
    { "file": "scripts/specbridge.ps1", "added_lines": 329, "deleted_lines": 1 },
    { "file": "scripts/test-specbridge-cli.ps1", "added_lines": 20, "deleted_lines": 0 },
    { "file": "scripts/validate-runtime-executions.ps1", "added_lines": 164, "deleted_lines": 1 }
  ],
  "validation_commands": [
    "powershell -NoProfile -ExecutionPolicy Bypass -File ./scripts/specbridge.ps1 v5-live-status",
    "powershell -NoProfile -ExecutionPolicy Bypass -File ./scripts/validate-runtime-executions.ps1",
    "powershell -NoProfile -ExecutionPolicy Bypass -File ./scripts/validate-contracts.ps1",
    "powershell -NoProfile -ExecutionPolicy Bypass -File ./scripts/validate-contract-scopes.ps1",
    "powershell -NoProfile -ExecutionPolicy Bypass -File ./scripts/validate-schemas.ps1",
    "powershell -NoProfile -ExecutionPolicy Bypass -File ./scripts/validate-final-reports.ps1",
    "powershell -NoProfile -ExecutionPolicy Bypass -File ./scripts/validate-audit-packets.ps1",
    "powershell -NoProfile -ExecutionPolicy Bypass -File ./scripts/validate-chatgpt-audits.ps1",
    "powershell -NoProfile -ExecutionPolicy Bypass -File ./scripts/specbridge.ps1 validate -Profile standard",
    "powershell -NoProfile -ExecutionPolicy Bypass -File ./scripts/test-specbridge-cli.ps1",
    "powershell -NoProfile -ExecutionPolicy Bypass -File ./scripts/test-specbridge-negative-validations.ps1",
    "powershell -NoProfile -ExecutionPolicy Bypass -File ./scripts/specbridge-smoke.ps1",
    "powershell -NoProfile -ExecutionPolicy Bypass -File ./scripts/validate-security-gates.ps1",
    "powershell -NoProfile -ExecutionPolicy Bypass -File ./scripts/validate-review-gate.ps1",
    "git diff --check",
    "GitHub CI"
  ],
  "validation_results": [
    { "command": "powershell -NoProfile -ExecutionPolicy Bypass -File ./scripts/specbridge.ps1 v5-live-status", "result": "passed" },
    { "command": "powershell -NoProfile -ExecutionPolicy Bypass -File ./scripts/validate-runtime-executions.ps1", "result": "passed" },
    { "command": "powershell -NoProfile -ExecutionPolicy Bypass -File ./scripts/validate-contracts.ps1", "result": "passed" },
    { "command": "powershell -NoProfile -ExecutionPolicy Bypass -File ./scripts/validate-contract-scopes.ps1", "result": "passed" },
    { "command": "powershell -NoProfile -ExecutionPolicy Bypass -File ./scripts/validate-schemas.ps1", "result": "passed" },
    { "command": "powershell -NoProfile -ExecutionPolicy Bypass -File ./scripts/validate-final-reports.ps1", "result": "passed" },
    { "command": "powershell -NoProfile -ExecutionPolicy Bypass -File ./scripts/validate-audit-packets.ps1", "result": "passed" },
    { "command": "powershell -NoProfile -ExecutionPolicy Bypass -File ./scripts/validate-chatgpt-audits.ps1", "result": "passed" },
    { "command": "powershell -NoProfile -ExecutionPolicy Bypass -File ./scripts/specbridge.ps1 validate -Profile standard", "result": "passed" },
    { "command": "powershell -NoProfile -ExecutionPolicy Bypass -File ./scripts/test-specbridge-cli.ps1", "result": "passed" },
    { "command": "powershell -NoProfile -ExecutionPolicy Bypass -File ./scripts/test-specbridge-negative-validations.ps1", "result": "passed" },
    { "command": "powershell -NoProfile -ExecutionPolicy Bypass -File ./scripts/specbridge-smoke.ps1", "result": "passed" },
    { "command": "powershell -NoProfile -ExecutionPolicy Bypass -File ./scripts/validate-security-gates.ps1", "result": "passed" },
    { "command": "powershell -NoProfile -ExecutionPolicy Bypass -File ./scripts/validate-review-gate.ps1", "result": "passed" },
    { "command": "git diff --check", "result": "passed" },
    { "command": "GitHub CI", "result": "not_collected" }
  ],
  "final_report_path": ".specbridge/reports/issue-078-v5-live-status-diagnostics.final-report.json",
  "ci_status": "not_collected",
  "pr_review_report_path": null,
  "policy_result": "Passed. Work stayed inside the issue 078 contract and scope. No live Claude Code or Antigravity launch, protected credential access, production change, dependency installation, auth or billing change, database change, CI/CD security change, or deployment occurred.",
  "unresolved_risks": [
    "GitHub PR CI evidence is pending.",
    "The next serious live pilot still needs to prove live executor completion without coordinator remediation."
  ],
  "completion_status": "complete_pending_pr_ci",
  "source_files": [
    ".specbridge/contracts/issue-078-v5-live-status-diagnostics.execution.md",
    ".specbridge/reports/issue-078-v5-live-status-diagnostics.final-report.json"
  ],
  "secret_omission": "This packet contains repository-relative paths, line-count summaries, validation summaries, policy result, risks, and status only. It does not embed raw diffs, file contents, secrets, tokens, private keys, or credential values."
}
