{
  "schema_version": "1",
  "task_id": "issue-246-agent-sdk-light-practices",
  "generated_by": "ChatGPT/Codex with bounded Claude Code audit",
  "execution_contract_path": ".specbridge/contracts/issue-246-agent-sdk-light-practices.execution.md",
  "changed_files": [
    ".specbridge/artifact-inventory/current.inventory.json",
    ".specbridge/audit-packets/issue-246-agent-sdk-light-practices.audit-packet.json",
    ".specbridge/audits/issue-246-agent-sdk-light-practices.chatgpt-audit.json",
    ".specbridge/context/CURRENT_GOAL.md",
    ".specbridge/contracts/issue-246-agent-sdk-light-practices.execution.md",
    ".specbridge/github-evidence/issue-246-agent-sdk-light-practices.closure.json",
    ".specbridge/ledger/operations.ndjson",
    ".specbridge/mcp-resources/operator-state.catalog.json",
    ".specbridge/reports/issue-246-agent-sdk-light-practices.final-report.json",
    ".specbridge/scopes/issue-246-agent-sdk-light-practices.scope.json",
    ".specbridge/standard-readiness/current.status.json",
    ".specbridge/state/current-goal.json",
    "CLAUDE.md",
    "README.md",
    "docs/specbridge-mcp-bounded-tools.md",
    "docs/specbridge-studio.html",
    "docs/specbridge-token-context-governance.md",
    "docs/status-dashboard.html",
    "scripts/lib/mcp-tools.ps1",
    "scripts/test-specbridge-cli.ps1"
  ],
  "diff_summary": [
    { "file": "scripts/lib/mcp-tools.ps1", "added_lines": null, "deleted_lines": null },
    { "file": "scripts/test-specbridge-cli.ps1", "added_lines": null, "deleted_lines": null },
    { "file": "CLAUDE.md", "added_lines": null, "deleted_lines": null },
    { "file": "docs/specbridge-mcp-bounded-tools.md", "added_lines": null, "deleted_lines": null },
    { "file": "docs/specbridge-token-context-governance.md", "added_lines": null, "deleted_lines": null },
    { "file": "README.md", "added_lines": null, "deleted_lines": null },
    { "file": ".specbridge/contracts/issue-246-agent-sdk-light-practices.execution.md", "added_lines": null, "deleted_lines": 0 },
    { "file": ".specbridge/scopes/issue-246-agent-sdk-light-practices.scope.json", "added_lines": null, "deleted_lines": 0 },
    { "file": ".specbridge/reports/issue-246-agent-sdk-light-practices.final-report.json", "added_lines": null, "deleted_lines": 0 },
    { "file": ".specbridge/audit-packets/issue-246-agent-sdk-light-practices.audit-packet.json", "added_lines": null, "deleted_lines": 0 },
    { "file": ".specbridge/audits/issue-246-agent-sdk-light-practices.chatgpt-audit.json", "added_lines": null, "deleted_lines": 0 },
    { "file": ".specbridge/github-evidence/issue-246-agent-sdk-light-practices.closure.json", "added_lines": null, "deleted_lines": 0 },
    { "file": ".specbridge/context/CURRENT_GOAL.md", "added_lines": null, "deleted_lines": null },
    { "file": ".specbridge/state/current-goal.json", "added_lines": null, "deleted_lines": null },
    { "file": ".specbridge/ledger/operations.ndjson", "added_lines": null, "deleted_lines": null },
    { "file": ".specbridge/artifact-inventory/current.inventory.json", "added_lines": null, "deleted_lines": null },
    { "file": ".specbridge/mcp-resources/operator-state.catalog.json", "added_lines": null, "deleted_lines": null },
    { "file": ".specbridge/standard-readiness/current.status.json", "added_lines": null, "deleted_lines": null },
    { "file": "docs/status-dashboard.html", "added_lines": null, "deleted_lines": null },
    { "file": "docs/specbridge-studio.html", "added_lines": null, "deleted_lines": null }
  ],
  "validation_commands": [
    "powershell -NoProfile -ExecutionPolicy Bypass -File ./scripts/validate-contracts.ps1",
    "powershell -NoProfile -ExecutionPolicy Bypass -File ./scripts/validate-contract-scopes.ps1",
    "powershell -NoProfile -ExecutionPolicy Bypass -File ./scripts/test-specbridge-cli.ps1",
    "powershell -NoProfile -ExecutionPolicy Bypass -File ./scripts/validate-final-reports.ps1",
    "powershell -NoProfile -ExecutionPolicy Bypass -File ./scripts/validate-audit-packets.ps1",
    "powershell -NoProfile -ExecutionPolicy Bypass -File ./scripts/validate-chatgpt-audits.ps1",
    "powershell -NoProfile -ExecutionPolicy Bypass -File ./scripts/specbridge-smoke.ps1",
    "git diff --check",
    "claude -p issue-246 bounded implementation audit"
  ],
  "validation_results": [
    { "command": "powershell -NoProfile -ExecutionPolicy Bypass -File ./scripts/validate-contracts.ps1", "result": "passed" },
    { "command": "powershell -NoProfile -ExecutionPolicy Bypass -File ./scripts/validate-contract-scopes.ps1", "result": "passed" },
    { "command": "powershell -NoProfile -ExecutionPolicy Bypass -File ./scripts/test-specbridge-cli.ps1", "result": "passed" },
    { "command": "powershell -NoProfile -ExecutionPolicy Bypass -File ./scripts/validate-final-reports.ps1", "result": "passed" },
    { "command": "powershell -NoProfile -ExecutionPolicy Bypass -File ./scripts/validate-audit-packets.ps1", "result": "passed" },
    { "command": "powershell -NoProfile -ExecutionPolicy Bypass -File ./scripts/validate-chatgpt-audits.ps1", "result": "passed" },
    { "command": "powershell -NoProfile -ExecutionPolicy Bypass -File ./scripts/specbridge-smoke.ps1", "result": "passed" },
    { "command": "git diff --check", "result": "passed" },
    { "command": "claude -p issue-246 bounded implementation audit", "result": "passed" },
    { "command": "GitHub Actions Foundation Validation", "result": "passed" },
    { "command": "GitHub Actions SpecBridge Review Gate", "result": "passed" },
    { "command": "GitHub Actions SpecBridge PR Review Report", "result": "passed" },
    { "command": "GitHub Actions Claude Review Non Blocking", "result": "passed" }
  ],
  "final_report_path": ".specbridge/reports/issue-246-agent-sdk-light-practices.final-report.json",
  "ci_status": "passed",
  "pr_review_report_path": null,
  "policy_result": "Within policy. The task adds read-only MCP metadata, tests, documentation, and evidence only. It does not install dependencies, host or import the Agent SDK, implement hooks, persist SDK sessions, create network MCP transport, add mutation-capable MCP tools, mutate GitHub or external resources through MCP, access protected credentials, configure billing, change production, implement auth, change databases, change CI/CD security, enforce cleanup, or deploy.",
  "unresolved_risks": [
    "Future SDK runtime, hooks, sessions, telemetry, network MCP transport, and mutation-capable tools require dedicated contracts."
  ],
  "completion_status": "complete",
  "source_files": [
    ".specbridge/audit-packets/issue-246-agent-sdk-light-practices.audit-packet.json",
    ".specbridge/audits/issue-246-agent-sdk-light-practices.chatgpt-audit.json",
    ".specbridge/contracts/issue-246-agent-sdk-light-practices.execution.md",
    ".specbridge/github-evidence/issue-246-agent-sdk-light-practices.closure.json",
    ".specbridge/reports/issue-246-agent-sdk-light-practices.final-report.json",
    ".specbridge/scopes/issue-246-agent-sdk-light-practices.scope.json",
    "CLAUDE.md",
    "docs/specbridge-mcp-bounded-tools.md",
    "docs/specbridge-token-context-governance.md",
    "scripts/lib/mcp-tools.ps1",
    "scripts/test-specbridge-cli.ps1"
  ],
  "secret_omission": "This packet contains repository-relative paths, summaries, validation results, policy result, risks, and status only. It does not embed raw diffs, private prompt content, provider output, credentials, private keys, or access material."
}
